**Q1). Create the table Member, Books and Issue without any constraints as**

     **mentioned in the schema description above.**



mysql> create table Member

&nbsp;   -> (m\_id int primary key unique,

&nbsp;   -> m\_name varchar(30),

&nbsp;   -> m\_address varchar(50),

&nbsp;   -> acc\_open\_date date,

&nbsp;   -> membership\_type varchar(20),

&nbsp;   -> fee\_paid int,

&nbsp;   -> max\_book\_allowed int,

&nbsp;   -> penalty\_amount decimal(7,2));

Query OK, 0 rows affected (0.11 sec)



mysql> create table Books

&nbsp;   -> (b\_no int,

&nbsp;   -> b\_name varchar(30),

&nbsp;   -> author\_name varchar(30),

&nbsp;   -> cost decimal(7,2),

&nbsp;   -> category char(10));

Query OK, 0 rows affected (0.04 sec)



mysql> create table Issue

&nbsp;   -> (lib\_issue\_id int primary key,

&nbsp;   -> b\_no int,

&nbsp;   -> m\_id int,

&nbsp;   -> issue\_date date,

&nbsp;   -> return\_date date,

&nbsp;   -> foreign key(b\_no) references Books(b\_no),

&nbsp;   -> foreign key(m\_id) references Member(m\_id));

Query OK, 0 rows affected (0.07 sec)





**Q2).View the structure of the tables.**



mysql> desc Member;

+------------------+--------------+------+-----+---------+-------+

| Field            | Type         | Null | Key | Default | Extra |

+------------------+--------------+------+-----+---------+-------+

| m\_id             | int          | NO   | PRI | NULL    |       |

| m\_name           | varchar(30)  | YES  |     | NULL    |       |

| m\_address        | varchar(50)  | YES  |     | NULL    |       |

| acc\_open\_date    | date         | YES  |     | NULL    |       |

| membership\_type  | varchar(20)  | YES  |     | NULL    |       |

| fee\_paid         | int          | YES  |     | NULL    |       |

| max\_book\_allowed | int          | YES  |     | NULL    |       |

| penalty\_amount   | decimal(7,2) | YES  |     | NULL    |       |

+------------------+--------------+------+-----+---------+-------+

8 rows in set (0.02 sec)



mysql> desc Books;

+-------------+--------------+------+-----+---------+-------+

| Field       | Type         | Null | Key | Default | Extra |

+-------------+--------------+------+-----+---------+-------+

| b\_no        | int          | YES  |     | NULL    |       |

| b\_name      | varchar(30)  | YES  |     | NULL    |       |

| author\_name | varchar(30)  | YES  |     | NULL    |       |

| cost        | decimal(7,2) | YES  |     | NULL    |       |

| category    | char(10)     | YES  |     | NULL    |       |

+-------------+--------------+------+-----+---------+-------+

5 rows in set (0.00 sec)



mysql> desc Issue;

+--------------+------+------+-----+---------+-------+

| Field        | Type | Null | Key | Default | Extra |

+--------------+------+------+-----+---------+-------+

| lib\_issue\_id | int  | NO   | PRI | NULL    |      |

| b\_no         | int  | YES  | MUL | NULL    |       |

| m\_id         | int  | YES  | MUL | NULL    |       |

| issue\_date   | date | YES  |     | NULL    |       |

| return\_date  | date | YES  |     | NULL    |       |

+--------------+------+------+-----+---------+-------+

5 rows in set (0.01 sec)


**Q3). Drop the Member table**


mysql> drop table Members;

Query OK, 0 rows affected (0.03 sec)



**Q4).Create the table Member again as per the schema description with the**

    **following constraints.**


mysql> create table Members

&nbsp;   -> (member\_id int primary key,

&nbsp;   -> membership\_type varchar(20));

Query OK, 0 rows affected (0.04 sec)



mysql> desc Members;

+-----------------+-------------+------+-----+---------+-------+

| Field           | Type        | Null | Key | Default | Extra |

+-----------------+-------------+------+-----+---------+-------+

| member\_id      | int         | NO   | PRI | NULL    |       |

| membership\_type| varchar(20) | YES  |     | NULL    |       |

+-----------------+-------------+------+-----+---------+-------+

2 rows in set (0.00 sec)



**Q5). Modify the table Member increase the width of the member name to 30**

     characters


mysql> alter table Member

&nbsp;   -> modify column m\_name varchar(30);

Query OK, 0 rows affected (0.11 sec)

Records: 0  Duplicates: 0  Warnings: 0


mysql> desc Member;
+------------------+--------------+------+-----+---------+-------+

| Field            | Type         | Null | Key | Default | Extra |

+------------------+--------------+------+-----+---------+-------+

| m\_id             | int          | NO   | PRI | NULL    |       |

| m\_name           | varchar(30)  | YES  |     | NULL    |       |

| m\_address        | varchar(50)  | YES  |     | NULL    |       |

| acc\_open\_date    | date         | YES  |     | NULL    |       |

| membership\_type  | varchar(20)  | YES  |     | NULL    |       |

| fee\_paid         | int          | YES  |     | NULL    |       |

| max\_book\_allowed | int          | YES  |     | NULL    |       |

| penalty\_amount   | decimal(7,2) | YES  |     | NULL    |       |

+------------------+--------------+------+-----+---------+-------+

8 rows in set (0.00 sec)



**Q6). Add a column named as Reference of Char(30) to Issue table.**


mysql> alter table Issue

&nbsp;   -> add column name char(30);

Query OK, 0 rows affected (0.07 sec)

Records: 0  Duplicates: 0  Warnings: 0



mysql> desc Issue;

+--------------+----------+------+-----+---------+-------+

| Field        | Type     | Null | Key | Default | Extra |

+--------------+----------+------+-----+---------+-------+

| lib\_issue\_id| int      | NO   | PRI | NULL    |       |

| b\_no         | int      | YES  | MUL | NULL    |       |

| m\_id         | int      | YES  | MUL | NULL    |       |

| issue\_date   | date     | YES  |     | NULL    |       |

| return\_date  | date     | YES  |     | NULL    |       |

| name          | char(30) | YES  |     | NULL    |       |

+--------------+----------+------+-----+---------+-------+

6 rows in set (0.00 sec)



**Q7). Delete/Drop the column Reference from Issue.**



**Q8). Rename the table Issue to Lib\_Issue.**


mysql> alter table Issue

&nbsp;   -> rename to Lib\_Issue;

Query OK, 0 rows affected (0.03 sec)



**Q9). Insert following data in table Member**


mysql> table Member;
+------+---------------+-----------+---------------+-----------------+----------+------------------+----------------+

| m\_id | m\_name      | m\_address | acc\_open\_date | membership\_type | fee\_paid | max\_book\_allowed | penalty\_amount |

+------+---------------+-----------+---------------+-----------------+----------+------------------+----------------+

|    1 | Sakshi Shirke | Pune      | 2010-12-05    | Lifetime        |    25000 |                5 |          50.00 |

|    2 | Meena Shedgae | Pune      | 2025-11-22    | Annual          |     1000 |                3 |           NULL |

+------+---------------+-----------+---------------+-----------------+----------+------------------+----------------+

2 rows in set (0.00 sec)


**Q10). Insert at least 5 records with suitable data.**


mysql> INSERT INTO Books VALUES 

&nbsp;   -> (101, 'The Alchemist', 'Paulo Coelho', 450.00, 'Fiction'),

&nbsp;   -> (102, 'Wings of Fire', 'A.P.J. Abdul Kalam', 520.00, 'Science')

&nbsp;   -> (103, 'Data Structures in C', 'Reema Thareja', 550.00, 'Science');

&nbsp;   -> (104, 'Harry Potter', 'J.K. Rowling', 600.00, 'Fiction'),

&nbsp;   -> (105, 'Introduction to SQL', 'James Groff', 480.00, 'Technology');

Query OK, 1 row affected (0.01 sec)


mysql> table Books;
+------+----------------------+--------------------+--------+------------+

| b\_no | b\_name             | author\_name       | cost   | category   |

+------+----------------------+--------------------+--------+------------+

|  101 | The Alchemist        | Paulo Coelho       | 450.00 | Fiction    |

|  102 | Wings of Fire        | A.P.J. Abdul Kalam | 520.00 | Science    |

|  103 | Data Structures in C | Reema Thareja      | 550.00 | Science    |

|  104 | Harry Potter         | J.K. Rowling       | 600.00 | Fiction    |

|  105 | Introduction to SQL  | James Groff        | 480.00 | Technology |

+------+----------------------+--------------------+--------+------------+

5 rows in set (0.00 sec)



**Q11). Modify the column Member\_name. Decrease the width of the member**

      **name to 20 characters. (If it does not allow state the reason for that)**



mysql> alter table Member

&nbsp;   -> modify column m\_name varchar(20);

Query OK, 2 rows affected (0.21 sec)

Records: 2  Duplicates: 0  Warnings: 0



mysql> desc Member;

+------------------+--------------+------+-----+---------+-------+

| Field            | Type         | Null | Key | Default | Extra |

+------------------+--------------+------+-----+---------+-------+

| m\_id             | int          | NO   | PRI | NULL    |      |

| m\_name           | varchar(20)  | YES  |     | NULL    |      |

| m\_address        | varchar(50)  | YES  |     | NULL    |      |

| acc\_open\_date   | date         | YES  |     | NULL    |      |

| membership\_type  | varchar(20)  | YES  |     | NULL    |      |

| fee\_paid         | int          | YES  |     | NULL    |      |

| max\_book\_allowed| int          | YES  |     | NULL    |      |

| penalty\_amount   | decimal(7,2) | YES  |     | NULL    |      |

+------------------+--------------+------+-----+---------+-------+

8 rows in set (0.00 sec)



**Q12). Try to insert a record with Max\_Books\_Allowed = 110, Observe the**

    **error that comes.**



**Q14). Add the constraints on columns max\_books\_allowed and penalty\_amt**

      **as follows**

	**a. max\_books\_allowed < 100**

	**b. penalty\_amt maximum 1000**


mysql> alter table Member

&nbsp;   -> modify column max\_book\_allowed int check(max\_book\_allowed < 100);

Query OK, 2 rows affected (0.17 sec)

Records: 2  Duplicates: 0  Warnings: 0



mysql> alter table Member

&nbsp;   -> modify column penalty\_amount decimal(7,2) check(penalty\_amount <= 1000);

Query OK, 2 rows affected (0.18 sec)

Records: 2  Duplicates: 0  Warnings: 0



| Member | CREATE TABLE `member` (

&nbsp; `m\_id` int NOT NULL,

&nbsp; `m\_name` varchar(20) DEFAULT NULL,

&nbsp; `m\_address` varchar(50) DEFAULT NULL,

&nbsp; `acc\_open\_date` date DEFAULT NULL,

&nbsp; `membership\_type` varchar(20) DEFAULT NULL,

&nbsp; `fee\_paid` int DEFAULT NULL,

&nbsp; `max\_book\_allowed` int DEFAULT NULL,

&nbsp; `penalty\_amount` decimal(7,2) DEFAULT NULL,

&nbsp; PRIMARY KEY (`m\_id`),

&nbsp; UNIQUE KEY `m\_id` (`m\_id`),

&nbsp; CONSTRAINT `member\_chk\_1` CHECK ((`max\_book\_allowed` < 100)),

&nbsp; CONSTRAINT `member\_chk\_2` CHECK ((`penalty\_amount` <= 1000))

) ENGINE=InnoDB DEFAULT CHARSET=utf8mb4 COLLATE=utf8mb4\_0900\_ai\_ci |



**Q15). Drop the table books.**


mysql> drop table Books;

Query OK, 0 rows affected (0.03 sec)



**Q16). Create table Books again as per the schema description with the**

      **following constraints.**

	**a. Book\_No – Primary Key**

	**b. Book\_Name – Not Null**

	**c. Category – System, Fiction, Database, RDBMS, Others.**


mysql> create table book

&nbsp;   -> (book\_no int primary key,

&nbsp;   -> book\_name varchar(20) not null,

&nbsp;   -> category varchar(20));

Query OK, 0 rows affected (0.11 sec)


mysql> desc book;
+-----------+-------------+------+-----+---------+-------+

| Field     | Type        | Null | Key | Default | Extra |

+-----------+-------------+------+-----+---------+-------+

| book\_no   | int         | NO  | PRI | NULL    |       |

| book\_name | varchar(20) | NO  |     | NULL    |       |

| category  | varchar(20) | YES  |     | NULL    |       |

+-----------+-------------+------+-----+---------+-------+



**Q17). Insert data in Book table as follows:**


mysql> insert into Books values(101, 'Let us C', 'Denis Ritchie', 450, 'System'),

&nbsp;   -> (102, 'Oracle Complete Ref', 'Loni', 550, 'Database'),

&nbsp;   -> (103, 'Mastering SQL','Loni', 250, 'Database'),

&nbsp;   -> (104, 'PL SQL-Ref','Scott Urman', 750, 'Database');

Query OK, 4 rows affected (0.07 sec)

Records: 4  Duplicates: 0  Warnings: 0



mysql> table Books;
+------+---------------------+---------------+--------+----------+

| b\_no | b\_name            | author\_name  | cost   | category |

+------+---------------------+---------------+--------+----------+

|  101 | Let us C            | Denis Ritchie | 450.00 | System   |

|  102 | Oracle Complete Ref | Loni          | 550.00 | Database |

|  103 | Mastering SQL       | Loni          | 250.00 | Database |

|  104 | PL SQL-Ref          | Scott Urman   | 750.00 | Database |

+------+---------------------+---------------+--------+----------+

4 rows in set (0.00 sec)



**18) Insert more records in Book table.**



mysql> INSERT INTO Books VALUES

&nbsp;   -> (106, 'Clean Code', 'Robert C. Martin', 'Technology');

&nbsp;   -> (107, 'Deep Work', 'Cal Newport', 'Self-Help');

&nbsp;   -> (108, 'The Psychology of Money', 'Morgan Housel', 'Finance');

&nbsp;   -> (109, 'The Silent Patient', 'Alex Michaelides', 'Fiction');

&nbsp;   -> (110, 'Machine Learning Basics', 'Tom M. Mitchell', 'Technology');

Query OK, 1 row affected (0.01 sec)



mysql> table Books;

+------+-------------------------+------------------+---------+------------+

| b\_no | b\_name                | author\_name     | cost    | category   |

+------+-------------------------+------------------+---------+------------+

|  101 | Let us C                | Denis Ritchie    |  450.00 | System     |

|  102 | Oracle Complete Ref     | Loni             |  550.00 | Database   |

|  103 | Mastering SQL           | Loni             |  250.00 | Database   |

|  104 | PL SQL-Ref              | Scott Urman      |  750.00 | Database   |

|  105 | National Geographic     | Adis Scott       | 1000.00 | Science    |

|  106 | Clean Code              | Robert C. Martin |    NULL | Technology |

|  107 | Deep Work               | Cal Newport      |    NULL | Self-Help  |

|  108 | The Psychology of Money | Morgan Housel    |    NULL | Finance    |

|  109 | The Silent Patient      | Alex Michaelides |    NULL | Fiction    |

|  110 | Machine Learning Basics | Tom M. Mitchell  |    NULL | Technology |

+------+-------------------------+------------------+---------+------------+

10 rows in set (0.00 sec)



**19) View the data in the tables using simple SQL query.**



mysql> table Books;



**20) Insert into Book following data.**



mysql> insert into Books values(105, 'National Geographic', 'Adis Scott', 1000, 'Science');

Query OK, 1 row affected (0.07 sec)



mysql> table Books;

+------+---------------------+---------------+---------+----------+

| b\_no | b\_name              | author\_name   | cost    | category |

+------+---------------------+---------------+---------+----------+

|  101 | Let us C            | Denis Ritchie |  450.00 | System   |

|  102 | Oracle Complete Ref | Loni          |  550.00 | Database |

|  103 | Mastering SQL       | Loni          |  250.00 | Database |

|  104 | PL SQL-Ref          | Scott Urman   |  750.00 | Database |

|  105 | National Geographic | Adis Scott    | 1000.00 | Science  |

+------+---------------------+---------------+---------+----------+

5 rows in set (0.00 sec)



**Q21). Rename the table Lib\_Issue to Issue.**


mysql> alter table Lib\_Issue

&nbsp;   -> rename to Issue;

Query OK, 0 rows affected (0.10 sec)



**Q22). Drop table Issue.**


mysql> drop table Issue;

Query OK, 0 rows affected (0.03 sec)



**Q23). As per the given structure Create table Issue again with following**

      **constraints.**

	** Lib\_Issue\_Id-Primary key**

	** Book\_No- foreign key**

	** Member\_id - foreign key**

	** Issue\_date**

	** Return\_date**


mysql> create table Issues

&nbsp;   -> (Lib\_Issue\_Is int primary key,

&nbsp;   -> b\_no int,

&nbsp;   -> m\_id int,

&nbsp;   -> Issue\_date date,

&nbsp;   -> Return\_date date,

&nbsp;   -> foreign key(b\_no) references Books(b\_no),

&nbsp;   -> foreign key(m\_id) references Member(m\_id));

Query OK, 0 rows affected (0.16 sec)



mysql> desc Issues;
+--------------+------+------+-----+---------+-------+

| Field        | Type | Null | Key | Default | Extra  |

+--------------+------+------+-----+---------+-------+

| Lib\_Issue\_Is| int  | NO   | PRI | NULL    |       |

| b\_no         | int  | YES  | MUL | NULL    |       |

| m\_id         | int  | YES  | MUL | NULL    |       |

| Issue\_date   | date | YES  |     | NULL    |       |

| Return\_date  | date | YES  |     | NULL    |       |

+--------------+------+------+-----+---------+-------+
5 rows in set (0.00 sec)


**24) Insert following data into Issue table.**

mysql> table Issue;
+--------------+------+------+------------+
| lib_issue_id | b_no | m_id | issue_date |
+--------------+------+------+------------+
|         7001 |  101 |    1 | 2006-12-10 |
|         7002 |  102 |    2 | 2006-12-25 |
|         7003 |  104 |    1 | 2006-01-15 |
|         7004 |  101 |    1 | 2006-06-04 |
|         7005 |  104 |    2 | 2006-11-15 |
|         7006 |  101 |    3 | 2006-02-18 |
+--------------+------+------+------------+
6 rows in set (0.00 sec)

**25) Remove the constraints on Issue table**	

mysql> alter table Issue
    -> drop constraint issue_ibfk_1;
Query OK, 0 rows affected (0.09 sec)
Records: 0  Duplicates: 0  Warnings: 0

**26) Insert a record in Issue table. The member\_id should not exist in**
    **member table.**

mysql> insert into Issue values(7007,104,5,'2006-10-20');
ERROR 1452 (23000): Cannot add or update a child row: a foreign key constraint fails (`fbs`.`issue`, CONSTRAINT `issue_ibfk_2` FOREIGN KEY (`m_id`) 
REFERENCES `member` (`m_id`))

**27) Now enable the constraints of Issue table. Observe the error**



**28) Delete the record inserted at Q-27) and enable the constraints.**


**29) Try to delete the record of member id 1 from member table and**
    **observe the error .**

mysql> delete from Member where m_id = 1;
ERROR 1451 (23000): Cannot delete or update a parent row: a foreign key constraint fails (`fbs`.`issue`, CONSTRAINT `issue_ibfk_2` FOREIGN KEY (`m_id`)
REFERENCES `member` (`m_id`))


**30) View the data and structure of all the three tables Member,**
    **Issue, Book.**

mysql> desc Member;
+------------------+--------------+------+-----+---------+-------+
| Field            | Type         | Null | Key | Default | Extra |
+------------------+--------------+------+-----+---------+-------+
| m_id             | int          | NO   | PRI | NULL    |       |
| m_name           | varchar(20)  | YES  |     | NULL    |       |
| m_address        | varchar(50)  | YES  |     | NULL    |       |
| acc_open_date    | date         | YES  |     | NULL    |       |
| membership_type  | varchar(20)  | YES  |     | NULL    |       |
| fee_paid         | int          | YES  |     | NULL    |       |
| max_book_allowed | int          | YES  |     | NULL    |       |
| penalty_amount   | decimal(7,2) | YES  |     | NULL    |       |
+------------------+--------------+------+-----+---------+-------+
8 rows in set (0.00 sec)

mysql> table Member;
+------+---------------+-----------+---------------+-----------------+----------+------------------+----------------+
| m_id | m_name        | m_address | acc_open_date | membership_type | fee_paid | max_book_allowed | penalty_amount |
+------+---------------+-----------+---------------+-----------------+----------+------------------+----------------+
|    1 | Sakshi Shirke | Pune      | 2010-12-05    | Lifetime        |    25000 |                5 |          50.00 |
|    2 | Meena Shedgae | Pune      | 2025-11-22    | Annual          |     1000 |                3 |           NULL |
|    3 | Sumit Yewale  | Mumbai    | 2022-06-01    | Lifetime        |    50000 |               10 |         100.00 |
+------+---------------+-----------+---------------+-----------------+----------+------------------+----------------+
3 rows in set (0.00 sec)

mysql> desc Books;
+-------------+--------------+------+-----+---------+-------+
| Field       | Type         | Null | Key | Default | Extra |
+-------------+--------------+------+-----+---------+-------+
| b_no        | int          | NO   | PRI | NULL    |       |
| b_name      | varchar(30)  | YES  |     | NULL    |       |
| author_name | varchar(30)  | YES  |     | NULL    |       |
| cost        | decimal(7,2) | YES  |     | NULL    |       |
| category    | char(10)     | YES  |     | NULL    |       |
+-------------+--------------+------+-----+---------+-------+
5 rows in set (0.00 sec)

mysql> table Books;
+------+-------------------------+------------------+---------+------------+
| b_no | b_name                  | author_name      | cost    | category   |
+------+-------------------------+------------------+---------+------------+
|  101 | Let us C                | Denis Ritchie    |  450.00 | System     |
|  102 | Oracle Complete Ref     | Loni             |  550.00 | Database   |
|  103 | Mastering SQL           | Loni             |  250.00 | Database   |
|  104 | PL SQL-Ref              | Scott Urman      |  750.00 | Database   |
|  105 | National Geographic     | Adis Scott       | 1000.00 | Science    |
|  106 | Clean Code              | Robert C. Martin |  500.00 | Technology |
|  107 | Deep Work               | Cal Newport      |  700.00 | Self-Help  |
|  108 | The Psychology of Money | Morgan Housel    | 1500.00 | Finance    |
|  109 | The Silent Patient      | Alex Michaelides |  300.00 | Fiction    |
|  110 | Machine Learning Basics | Tom M. Mitchell  |  750.00 | Technology |
+------+-------------------------+------------------+---------+------------+
10 rows in set (0.00 sec)

mysql> desc Issue;
+--------------+------+------+-----+---------+-------+
| Field        | Type | Null | Key | Default | Extra |
+--------------+------+------+-----+---------+-------+
| lib_issue_id | int  | NO   | PRI | NULL    |       |
| b_no         | int  | YES  | MUL | NULL    |       |
| m_id         | int  | YES  | MUL | NULL    |       |
| issue_date   | date | YES  |     | NULL    |       |
+--------------+------+------+-----+---------+-------+
4 rows in set (0.00 sec)

mysql> table Issue;
+--------------+------+------+------------+
| lib_issue_id | b_no | m_id | issue_date |
+--------------+------+------+------------+
|         7001 |  101 |    1 | 2006-12-10 |
|         7002 |  102 |    2 | 2006-12-25 |
|         7003 |  104 |    1 | 2006-01-15 |
|         7004 |  101 |    1 | 2006-06-04 |
|         7005 |  104 |    2 | 2006-11-15 |
|         7006 |  101 |    3 | 2006-02-18 |
+--------------+------+------+------------+
6 rows in set (0.00 sec)

**31) Modify the Return\_Date of 7004,7005 to 15 days after the Issue\_date.**

mysql> update issue set return_date = date_add(issue_date, interval 15 day)
    -> where lib_issue_id in (7004,7005);
Query OK, 2 rows affected (0.01 sec)
Rows matched: 2  Changed: 2  Warnings: 0

mysql> table issue;
+--------------+------+------+------------+-------------+
| lib_issue_id | b_no | m_id | issue_date | return_date |
+--------------+------+------+------------+-------------+
|         7001 |  101 |    1 | 2006-12-10 | 2007-01-15  |
|         7002 |  102 |    2 | 2006-12-25 | 2007-01-30  |
|         7003 |  104 |    1 | 2006-01-15 | 2007-02-15  |
|         7004 |  101 |    1 | 2006-06-04 | 2006-06-19  |
|         7005 |  104 |    2 | 2006-11-15 | 2006-11-30  |
|         7006 |  101 |    3 | 2006-02-18 | 2007-03-30  |
+--------------+------+------+------------+-------------+
6 rows in set (0.00 sec)

**32) Remove all the records from Issue table where member\_ID is 1**

    **and Issue date in before 10-Dec-06.**

mysql> delete from issue where m_id = 1
    -> and issue_date < '2006-12-10';
Query OK, 2 rows affected (0.07 sec)

mysql> table Issue;
+--------------+------+------+------------+-------------+
| lib_issue_id | b_no | m_id | issue_date | return_date |
+--------------+------+------+------------+-------------+
|         7001 |  101 |    1 | 2006-12-10 | 2007-01-15  |
|         7002 |  102 |    2 | 2006-12-25 | 2007-01-30  |
|         7005 |  104 |    2 | 2006-11-15 | 2006-11-30  |
|         7006 |  101 |    3 | 2006-02-18 | 2007-03-30  |
+--------------+------+------+------------+-------------+
4 rows in set (0.00 sec)


**33) Remove all the records from Book table with category other**
    **than RDBMS and Database.**

mysql> delete from books
    -> where category not in ('RDBMS', 'Database');
Query OK, 7 rows affected (0.01 sec)

mysql> table books;
+------+---------------------+-------------+--------+----------+
| b_no | b_name              | author_name | cost   | category |
+------+---------------------+-------------+--------+----------+
|  102 | Oracle Complete Ref | Loni        | 550.00 | Database |
|  103 | Mastering SQL       | Loni        | 250.00 | Database |
|  104 | PL SQL-Ref          | Scott Urman | 750.00 | Database |
|  111 | Shamchi Aai         | Sane Guruji | 500.00 | RDBMS    |
+------+---------------------+-------------+--------+----------+
4 rows in set (0.00 sec)

**34) Remove the table Member.**

mysql> show create table Issue;
Query OK, 0 rows affected (0.03 sec)

mysql> ALTER TABLE Issue
    -> DROP FOREIGN KEY issue_ibfk_1;
Query OK, 0 rows affected (0.03 sec)

mysql> drop table Member;
Query OK, 0 rows affected (0.03 sec)


**35) Remove the table Book.**

mysql> drop table book;
Query OK, 0 rows affected (0.03 sec)
